{"credentials_required_for_doctor":false,"fixture_ready":true,"health":"degraded","live_capabilities":["page.performance"],"ok":true,"runtime":"kujo-native","schema":"searchbridge.doctor/v1","unavailable_capabilities":["analytics","backlinks","field.performance","index.submission","keyword.data","search.performance","url.inspection"],"warnings":["Most API v3 requests consume Ahrefs API units."]}
